title,date_published,date_modified,content,road,town,location,all_text,fatalities_mentioned,fatalities_count,vehicles,accident_types,hospital,injuries,brands,day,time,age,latitude,longitude,hourly_temperature_2m,hourly_precipitation,hourly_rain,hourly_showers,hourly_visibility,hourly_windspeed_10m,hourly_winddirection_10m,daily_weather_code,daily_rain_sum,daily_wind_gusts_10m_max,daily_wind_speed_10m_max,daily_wind_direction_10m_dominant,weather_matched_hour_utc
Traffic accident in Gzira,2025-09-05,2025-09-05,"Yesterday, at around 1815hrs, the police were informed of a traffic accident in Triq Ix-Xatt, Gzira.The Police went immediately on site and preliminary investigations showed that a collision had occurred between a moped Surron light Bee driven by a 24-year-old man residing in Tarxien and a Honda NSC110 motorcycle driven by a 35-year-old Libyan man residing in Zurrieq.A medical team was called on site and an ambulance took the two men to Mater Dei Hospital. Later, the motorcyclist was certified to have sustained grievous injuries while the other was certified to have suffered slight injuries.Police investigations are ongoing.",Triq Ix-Xatt,Il-Gżira,"('Triq Ix-Xatt', 'Il-Gżira')","Traffic accident in Gzira Yesterday, at around 1815hrs, the police were informed of a traffic accident in Triq Ix-Xatt, Gzira.The Police went immediately on site and preliminary investigations showed that a collision had occurred between a moped Surron light Bee driven by a 24-year-old man residing in Tarxien and a Honda NSC110 motorcycle driven by a 35-year-old Libyan man residing in Zurrieq.A medical team was called on site and an ambulance took the two men to Mater Dei Hospital. Later, the motorcyclist was certified to have sustained grievous injuries while the other was certified to have suffered slight injuries.Police investigations are ongoing.",False,,['Motorcycle'],"['Collision', 'Accident']",['Mater Dei'],"['Slight', 'Grievous']",['Honda'],Friday,18:15,24,35.9077803,14.4961247,22.414501190185547,0.0,0.0,0.0,12360.0,4.072935104370117,224.99989318847656,2.0,0.0,29.8799991607666,12.287554740905762,279.2249450683594,2025-09-05 22:00:00+00:00
Two-car accident in Birżebbuġa,2025-04-14,2025-04-14,"Yesterday, at about 1745hrs, the Police were informed of a traffic accident in Birżebbuġa Road, Birżebbuġa.Preliminary investigations found that a collision occurred between a Smart driven by a 41-year-old man from Gudja and a Toyota Passo driven by a 36-year-old woman from Żabbar.A medical team was called on site and an ambulance took the man to Mater Dei Hospital. He was later certified to have sustained grievous injuries.Police investigations are ongoing.",Birżebbuġa Road,Birżebbuġa,"('Birżebbuġa Road', 'Birżebbuġa')","Two-car accident in Birżebbuġa Yesterday, at about 1745hrs, the Police were informed of a traffic accident in Birżebbuġa Road, Birżebbuġa.Preliminary investigations found that a collision occurred between a Smart driven by a 41-year-old man from Gudja and a Toyota Passo driven by a 36-year-old woman from Żabbar.A medical team was called on site and an ambulance took the man to Mater Dei Hospital. He was later certified to have sustained grievous injuries.Police investigations are ongoing.",False,,['Car'],"['Collision', 'Accident']",['Mater Dei'],['Grievous'],"['Smart', 'Toyota']",Monday,17:45,41,35.8269478,14.5274189,17.647499084472656,0.0,0.0,0.0,26520.0,17.727943420410156,113.96249389648438,3.0,0.0,51.839996337890625,28.820241928100586,134.49795532226562,2025-04-14 22:00:00+00:00
Motorcycle accident,2025-07-24,2025-07-24,"A 65-year-old man, a resident of Mellieħa, was taken to Mater Dei Hospital at about 1015 hrs after he was injured in an accident in Salina Road, Naxxar.Preliminary investigations showed that the man was riding a Honda motorcycle, lost control, crashed into a pavement and fell off.He was assisted by a medical team, taken to hospital by an ambulance and certified thathe was grievously injured.Police investigations are ongoing.",an accident in Salina Road,In-Naxxar,"('an accident in Salina Road', 'In-Naxxar')","Motorcycle accident A 65-year-old man, a resident of Mellieħa, was taken to Mater Dei Hospital at about 1015 hrs after he was injured in an accident in Salina Road, Naxxar.Preliminary investigations showed that the man was riding a Honda motorcycle, lost control, crashed into a pavement and fell off.He was assisted by a medical team, taken to hospital by an ambulance and certified thathe was grievously injured.Police investigations are ongoing.",False,,['Motorcycle'],['Accident'],['Mater Dei'],[],['Honda'],Thursday,10:15,65,35.9133396,14.4432851,27.818998336791992,0.0,0.0,0.0,54920.0,1.8356469869613647,348.6900939941406,0.0,0.0,16.919998168945312,7.862518310546875,246.39280700683594,2025-07-24 22:00:00+00:00
Traffic accident in Ħamrun,2025-05-12,2025-05-15,"A 62-year-old man and residing in Sliema, at around 0945hrs, was taken to Mater Dei Hospital because he was injured in a traffic accident in St Joseph High Road, Ħamrun.Preliminary investigations showed that a collision occurred between a Renault Captur driven by a 54-year-old woman residing in Birzebbuġa and a Lemoto AURA motorcycle driven by the victim.He was assisted by a medical team, taken to hospital by ambulance and certified to have sustained grievous injuries.Police investigations are ongoing.",St Joseph High Road,Il-Ħamrun,"('St Joseph High Road', 'Il-Ħamrun')","Traffic accident in Ħamrun A 62-year-old man and residing in Sliema, at around 0945hrs, was taken to Mater Dei Hospital because he was injured in a traffic accident in St Joseph High Road, Ħamrun.Preliminary investigations showed that a collision occurred between a Renault Captur driven by a 54-year-old woman residing in Birzebbuġa and a Lemoto AURA motorcycle driven by the victim.He was assisted by a medical team, taken to hospital by ambulance and certified to have sustained grievous injuries.Police investigations are ongoing.",False,,"['Motorcycle', 'Car']","['Collision', 'Accident']",['Mater Dei'],['Grievous'],['Renault'],Monday,09:45,62,35.8867896,14.4854096,18.33449935913086,0.0,0.0,0.0,20300.0,11.753876686096191,297.34979248046875,3.0,0.0,41.39999771118164,18.59844970703125,334.41912841796875,2025-05-12 22:00:00+00:00
Man grievously injured in a traffic accident,2025-02-04,2025-02-04,"Yesterday, at around 1900 hrs, the Police were informed of a traffic accident in Triq il-Palma, Paola.Preliminary investigations showed that a 68-year-old man, a resident of Paola, was hit by a Renault Clio that was being driven by a 44-year-old man, also a resident of Paola.The victim was assisted by a medical team and taken to Mater Dei Hospital by an ambulance. He was later certified to have sustained grievous injuries.The Police are investigating the case",Triq il-Palma,Raħal Ġdid,"('Triq il-Palma', 'Raħal Ġdid')","Man grievously injured in a traffic accident Yesterday, at around 1900 hrs, the Police were informed of a traffic accident in Triq il-Palma, Paola.Preliminary investigations showed that a 68-year-old man, a resident of Paola, was hit by a Renault Clio that was being driven by a 44-year-old man, also a resident of Paola.The victim was assisted by a medical team and taken to Mater Dei Hospital by an ambulance. He was later certified to have sustained grievous injuries.The Police are investigating the case",False,,"['Pedestrian', 'Car']",['Accident'],['Mater Dei'],['Grievous'],['Renault'],Tuesday,19:00,68,35.8717994,14.5073748,11.514999389648438,0.0,0.0,0.0,34580.0,2.9024126529693604,330.2552185058594,3.0,0.0,19.440000534057617,8.89134407043457,344.0545349121094,2025-02-04 22:00:00+00:00
Persons injured in separate traffic accidents,2025-01-15,2025-01-15,"Two men were taken to Mater Dei Hospital after being injured in two separate traffic accidents earlier today.The first accident occurred at around 0745hrs, in Triq Anton Cassar, Marsa. Preliminary investigations showed that a collision occurred between a Suzuki motorcycle driven by a 21-year-old man residing in Fgura and a Toyota Vitz driven by a 21-year-old woman residing in Qormi.The second incident happened at around 0800hrs, in Triq Tal-Barrani, Żejtun. Preliminary investigations showed that a 30-year-old Italian man, who lives in Għaxaq, was riding a Yamaha motorcycle, lost control and fell.A medical team assisted in both accidents and the two motorcyclists were taken to hospital by ambulance for medical treatment, where they were certified to have sustained grievous injuries.Police investigations are ongoing.",Triq Tal-Barrani,Iż-Żejtun,"('Triq Tal-Barrani', 'Iż-Żejtun')","The first accident occurred at around 0745hrs, in Triq Anton Cassar, Marsa. Preliminary investigations showed that a collision occurred between a Suzuki motorcycle driven by a 21-year-old man residing in Fgura and a Toyota Vitz driven by a 21-year-old woman residing in Qormi.",False,,"['Motorcycle', 'Car']","['Collision', 'Accident']",[],[],"['Suzuki', 'Toyota']",Wednesday,07:45,21,35.853701,14.53153,10.156499862670898,0.20000000298023224,0.0,0.20000000298023224,5960.0,0.35999998450279236,90.0,80.0,0.0,56.519996643066406,24.482646942138672,24.83115577697754,2025-01-15 22:00:00+00:00
Persons injured in separate traffic accidents,2025-01-15,2025-01-15,"Two men were taken to Mater Dei Hospital after being injured in two separate traffic accidents earlier today.The first accident occurred at around 0745hrs, in Triq Anton Cassar, Marsa. Preliminary investigations showed that a collision occurred between a Suzuki motorcycle driven by a 21-year-old man residing in Fgura and a Toyota Vitz driven by a 21-year-old woman residing in Qormi.The second incident happened at around 0800hrs, in Triq Tal-Barrani, Żejtun. Preliminary investigations showed that a 30-year-old Italian man, who lives in Għaxaq, was riding a Yamaha motorcycle, lost control and fell.A medical team assisted in both accidents and the two motorcyclists were taken to hospital by ambulance for medical treatment, where they were certified to have sustained grievous injuries.Police investigations are ongoing.",Triq Tal-Barrani,Iż-Żejtun,"('Triq Tal-Barrani', 'Iż-Żejtun')","The second incident happened at around 0800hrs, in Triq Tal-Barrani, Żejtun. Preliminary investigations showed that a 30-year-old Italian man, who lives in Għaxaq, was riding a Yamaha motorcycle, lost control and fell.A medical team assisted in both accidents and the two motorcyclists were taken to hospital by ambulance for medical treatment, where they were certified to have sustained grievous injuries.Police investigations are ongoing.",False,,['Motorcycle'],[],[],['Grievous'],['Yamaha'],Wednesday,08:00,30,35.853701,14.53153,10.156499862670898,0.20000000298023224,0.0,0.20000000298023224,5960.0,0.35999998450279236,90.0,80.0,0.0,56.519996643066406,24.482646942138672,24.83115577697754,2025-01-15 22:00:00+00:00
Fatal traffic accident in Marsascala,2025-06-12,2025-06-12,"Today at around 1000hrs, the Police were informed of a traffic accident in Triq Villabate, Marsascala.Preliminary investigations showed that a collision occurred between a Peugeot partner that was being driven by a 38-year-old man from Ivory Coast and a resident of Marsa, a Nissan March that was being driven by a 43-year-old Italian and a 67-year-old cyclist from Żejtun. In the Nissan there was also a 38-year-old Italian who was taken to Mater Dei by an ambulance.The cyclist was assisted by a medical team on site but was unfortunately certified dead. The condition of the Italian is not yet known.Magistrate Dr Philip Galea Farrugia LL.D was informed of the case and appointed an inquiry.Police investigations are ongoing.",Triq Villabate,Marsaskala,"('Triq Villabate', 'Marsaskala')","Fatal traffic accident in Marsascala Today at around 1000hrs, the Police were informed of a traffic accident in Triq Villabate, Marsascala.Preliminary investigations showed that a collision occurred between a Peugeot partner that was being driven by a 38-year-old man from Ivory Coast and a resident of Marsa, a Nissan March that was being driven by a 43-year-old Italian and a 67-year-old cyclist from Żejtun. In the Nissan there was also a 38-year-old Italian who was taken to Mater Dei by an ambulance.The cyclist was assisted by a medical team on site but was unfortunately certified dead. The condition of the Italian is not yet known.Magistrate Dr Philip Galea Farrugia LL.D was informed of the case and appointed an inquiry.Police investigations are ongoing.",True,,"['Motorcycle', 'Car']","['Collision', 'Accident']",['Mater Dei'],[],"['Peugeot', 'Nissan']",Thursday,10:00,38,35.8629162,14.5591879,24.020999908447266,0.0,0.0,0.0,35860.0,2.4149534702301025,333.4350280761719,1.0,0.0,23.759998321533203,11.304228782653809,53.0247688293457,2025-06-12 22:00:00+00:00
Arrested following a traffic accident in Gozo,2025-09-20,2025-09-20,"A 30-year-old Englishman is being detained after he allegedly stole a motorcycle in Gozo and shortly afterwards was involved in a collision with the same motorcycle.At around 1330 hrs, the Police were informed of a traffic accident in Triq L-Għarb, Għarb. Police went immediately on site where they found that an accident had occurred between two motorcycles, a Honda and a Kymco, and the Honda driver, a 34-year-old man from Xagħra, needed medical assistance.At this point, persons who were on site informed the police that the Kymco driver, probably a British national, fled the scene. A search immediately began, and shortly afterwards he was found in the vicinity of the accident and was arrested. During the arrest he was aggressive towards the police, who were not injured.During investigations, the Police found that the Kymco motorcycle had just been stolen from Sannat, allegedly from the same British man who was involved in the traffic accident and then fled the scene.The two men were taken to the Gozo General Hospital because of the injuries they sustained in the accident, where the 34-year-old man was later certified to have sustained grievous injuries, while the condition of the arrested person is still pending.Police investigations into this case are ongoing.",Triq L-Għarb,L-Għarb,"('Triq L-Għarb', 'L-Għarb')","Arrested following a traffic accident in Gozo A 30-year-old Englishman is being detained after he allegedly stole a motorcycle in Gozo and shortly afterwards was involved in a collision with the same motorcycle.At around 1330 hrs, the Police were informed of a traffic accident in Triq L-Għarb, Għarb. Police went immediately on site where they found that an accident had occurred between two motorcycles, a Honda and a Kymco, and the Honda driver, a 34-year-old man from Xagħra, needed medical assistance.At this point, persons who were on site informed the police that the Kymco driver, probably a British national, fled the scene. A search immediately began, and shortly afterwards he was found in the vicinity of the accident and was arrested. During the arrest he was aggressive towards the police, who were not injured.During investigations, the Police found that the Kymco motorcycle had just been stolen from Sannat, allegedly from the same British man who was involved in the traffic accident and then fled the scene.The two men were taken to the Gozo General Hospital because of the injuries they sustained in the accident, where the 34-year-old man was later certified to have sustained grievous injuries, while the condition of the arrested person is still pending.Police investigations into this case are ongoing.",False,,['Motorcycle'],"['Collision', 'Accident']",['Gozo General Hospital'],"['Grievous', 'The']","['Honda', 'Kymco']",Saturday,13:30,30,36.0598182,14.209081,24.831998825073242,0.0,0.0,0.0,52920.0,7.2448601722717285,116.56498718261719,3.0,0.0,33.839996337890625,18.345876693725586,76.61385345458984,2025-09-20 22:00:00+00:00
Woman grievously injured in traffic accident,2024-12-11,2024-12-11,"A 60-year-old woman residing in Swieqi, at around 1115hrs, was taken to Mater Dei Hospital because she was injured in a traffic accident in Triq E. Bradford corner with Triq il-Kappella tax-Xagħra, Naxxar.Preliminary investigations showed that the woman was hit by a Volkswagen Polo driven by a 48-year-old woman who lives in Mosta.The victim was assisted by a medical team, taken to hospital by ambulance and certified to have sustained grievous injuries.Police investigations are ongoing.",Triq E. Bradford corner with Triq il-Kappella tax-Xagħra,In-Naxxar,"('Triq E. Bradford corner with Triq il-Kappella tax-Xagħra', 'In-Naxxar')","Woman grievously injured in traffic accident A 60-year-old woman residing in Swieqi, at around 1115hrs, was taken to Mater Dei Hospital because she was injured in a traffic accident in Triq E. Bradford corner with Triq il-Kappella tax-Xagħra, Naxxar.Preliminary investigations showed that the woman was hit by a Volkswagen Polo driven by a 48-year-old woman who lives in Mosta.The victim was assisted by a medical team, taken to hospital by ambulance and certified to have sustained grievous injuries.Police investigations are ongoing.",False,,"['Pedestrian', 'Car']",['Accident'],['Mater Dei'],['Grievous'],['Volkswagen'],Wednesday,11:15,60,35.9133396,14.4432851,15.369000434875488,0.0,0.0,0.0,40140.0,10.079999923706055,90.0,3.0,0.0,20.15999984741211,10.239453315734863,74.10710144042969,2024-12-11 22:00:00+00:00
Fgura traffic accident,2025-01-07,2025-01-11,"Update:Unfortunately, the 24-year-old woman recently lost her life at Mater Dei Hospital.The Magisterial Inquiry and Police investigations are ongoing.Earlier:Yesterday, at around 2000hrs, two women, aged 34 and 24 from Nepal, were taken to Mater Dei Hospital after being injured in a traffic accident in Triq Hompesh, Fgura.It resulted from initial investigations that the two women were hit by a Toyota Hilux that was being driven by a 20-year-old woman from Birżebbuġa.The victims were assisted by a medical team and taken to hospital by an ambulance where the 24-year-old woman was later certified to have sustained grievous injuries while the other woman was certified to have sustained grievous injuries.Magistrate Ian Farrugia LL.D was informed about the case who opened an inquiry while Police investigations are still ongoing.",Triq Hompesh,Il-Fgura,"('Triq Hompesh', 'Il-Fgura')","Fgura traffic accident Update:Unfortunately, the 24-year-old woman recently lost her life at Mater Dei Hospital.The Magisterial Inquiry and Police investigations are ongoing.Earlier:Yesterday, at around 2000hrs, two women, aged 34 and 24 from Nepal, were taken to Mater Dei Hospital after being injured in a traffic accident in Triq Hompesh, Fgura.It resulted from initial investigations that the two women were hit by a Toyota Hilux that was being driven by a 20-year-old woman from Birżebbuġa.The victims were assisted by a medical team and taken to hospital by an ambulance where the 24-year-old woman was later certified to have sustained grievous injuries while the other woman was certified to have sustained grievous injuries.Magistrate Ian Farrugia LL.D was informed about the case who opened an inquiry while Police investigations are still ongoing.",False,,['Car'],['Accident'],['Mater Dei'],['Grievous'],['Toyota'],Tuesday,20:00,24,35.8728325,14.520799,13.902000427246094,0.0,0.0,0.0,17060.0,7.4215898513793945,292.83367919921875,3.0,0.0,42.47999954223633,18.864824295043945,217.1280517578125,2025-01-07 22:00:00+00:00
Fgura traffic accident,2025-07-27,2025-07-27,"Today, at around 1530hrs, the Police were informed of a traffic accident in Hompesch Street, Fgura.Preliminary investigations showed that a collision occurred between a Toyota Corolla driven by a 23-year-old woman from Zabbar and an Audi Q3 driven by a 77-year-old man from Marsascala.In the Toyota there was also a 71-year-old woman residing in Zabbar while in the Audi there were also two women aged 76 and 42 years, both residing in Marsascala, and two boys aged 14 and 11 years.Members of the Civil Protection Department and a medical team were called to the scene and ambulances took all the persons to Mater Dei Hospital for treatment.Unfortunately, the 71-year-old woman was certified dead a short while later while the 23-year-old woman is in serious condition, the 77-year-old man and the 76-year-old woman were certified to have sustained grievous injuries.The condition of the other persons is still pending.Magistrate Dr Ian Farrugia LL.D was informed of the case and appointed an inquiry.Police investigations into this incident are ongoing.",Hompesch Street,Il-Fgura,"('Hompesch Street', 'Il-Fgura')","Fgura traffic accident Today, at around 1530hrs, the Police were informed of a traffic accident in Hompesch Street, Fgura.Preliminary investigations showed that a collision occurred between a Toyota Corolla driven by a 23-year-old woman from Zabbar and an Audi Q3 driven by a 77-year-old man from Marsascala.In the Toyota there was also a 71-year-old woman residing in Zabbar while in the Audi there were also two women aged 76 and 42 years, both residing in Marsascala, and two boys aged 14 and 11 years.Members of the Civil Protection Department and a medical team were called to the scene and ambulances took all the persons to Mater Dei Hospital for treatment.Unfortunately, the 71-year-old woman was certified dead a short while later while the 23-year-old woman is in serious condition, the 77-year-old man and the 76-year-old woman were certified to have sustained grievous injuries.The condition of the other persons is still pending.Magistrate Dr Ian Farrugia LL.D was informed of the case and appointed an inquiry.Police investigations into this incident are ongoing.",True,,['Car'],"['Collision', 'Accident']",['Mater Dei'],['Grievous'],"['Audi', 'Toyota']",Sunday,15:30,23,35.8728325,14.520799,25.50200080871582,0.0,0.0,0.0,40700.0,20.390113830566406,312.13751220703125,1.0,0.0,60.47999572753906,26.959165573120117,310.4027099609375,2025-07-27 22:00:00+00:00
Boy seriously injured in Buġibba accident,2025-05-26,2025-05-26,A 5-year-old boy sustained serious injuries after he was hit by a vehicle in Triq iċ-Ċern earlier today at around fifteen minutes past one in the afternoon (1315 hrs).From initial investigations it appears that he suffered head injuries when he was hit by the mirror of a Volkswagen Polo mirror which was being driven by a 22-year-old man from Msida.A medical team assisted the boy and was immediately taken to Mater Dei Hospital by ambulance.Magistrate Dr Philip Galea Farrugia LL. D. was informed and appointed an inquiry into the case while Police investigations are ongoing.,,L-Imsida,"(None, 'L-Imsida')",Boy seriously injured in Buġibba accident A 5-year-old boy sustained serious injuries after he was hit by a vehicle in Triq iċ-Ċern earlier today at around fifteen minutes past one in the afternoon (1315 hrs).From initial investigations it appears that he suffered head injuries when he was hit by the mirror of a Volkswagen Polo mirror which was being driven by a 22-year-old man from Msida.A medical team assisted the boy and was immediately taken to Mater Dei Hospital by ambulance.Magistrate Dr Philip Galea Farrugia LL. D. was informed and appointed an inquiry into the case while Police investigations are ongoing.,False,,"['Pedestrian', 'Vehicle', 'Car']",['Accident'],['Mater Dei'],"['Serious', 'Head']",['Volkswagen'],Monday,13:15,5,35.8956943,14.4891829,17.944499969482422,0.0,0.0,0.0,11360.0,5.447788238525391,262.40545654296875,1.0,0.0,31.68000030517578,13.450708389282227,328.3280944824219,2025-05-26 22:00:00+00:00
Traffic accident,2025-10-02,2025-10-02,"This morning, at around 0530 hrs, the Police were informed of a traffic accident in Triq L-Imġarr, Qala, Gozo.The Police went immediately on site and from preliminary investigations it resulted that a collision had occurred between a Kia Picanto that was being driven by a 53-year-old woman from Qala and a Honda NSC motorcycle that was being driven by a 47-year-old man, a resident of Nadur.A medical team was called on site and an ambulance took the motorcyclist to Gozo General Hospital. He was later certified to have sustained grievous injuries.Police investigations are ongoing.",Triq L-Imġarr,Il-Qala,"('Triq L-Imġarr', 'Il-Qala')","Traffic accident This morning, at around 0530 hrs, the Police were informed of a traffic accident in Triq L-Imġarr, Qala, Gozo.The Police went immediately on site and from preliminary investigations it resulted that a collision had occurred between a Kia Picanto that was being driven by a 53-year-old woman from Qala and a Honda NSC motorcycle that was being driven by a 47-year-old man, a resident of Nadur.A medical team was called on site and an ambulance took the motorcyclist to Gozo General Hospital. He was later certified to have sustained grievous injuries.Police investigations are ongoing.",False,,"['Motorcycle', 'Car']","['Collision', 'Accident']",['Gozo General Hospital'],['Grievous'],"['Kia', 'Honda']",Thursday,05:30,53,36.036291,14.3103502,20.905500411987305,0.0,0.0,0.0,72540.0,22.45026397705078,344.18072509765625,80.0,0.0,65.15999603271484,28.257131576538086,315.4527282714844,2025-10-02 22:00:00+00:00
